id,timestamp,transcript,convo,paused
1,2024-12-01 16:33:28+00:00,We also have to consider the environmental impact. AI requires enormous computational resources.,0,False
0,2024-12-01 16:33:31+00:00,"Training large AI models consumes vast amounts of energy, contributing to carbon emissions.",0,False
1,2024-12-01 16:33:34+00:00,There’s growing interest in developing more energy-efficient algorithms to tackle this issue.,0,False
0,2024-12-01 16:33:37+00:00,That’s promising. Sustainable AI should be a priority as the technology advances.,0,False
1,2024-12-01 16:33:40+00:00,One more issue: misinformation. AI can create deepfakes and spread fake news.,0,False
0,2024-12-01 16:33:43+00:00,Deepfakes are especially concerning because they can erode trust in media and even democracy.,0,False
1,2024-12-01 16:33:46+00:00,"AI companies are working on detection tools, but it’s a constant arms race.",0,False
0,2024-12-01 16:33:49+00:00,"So, what’s the solution? Regulation, ethics, public awareness—all of the above?",0,False
1,2024-12-01 16:33:52+00:00,Probably all of the above. It will take a multi-stakeholder effort to ensure AI is used responsibly.,0,False
0,2024-12-01 16:33:54+00:00,It’s exciting but also a bit daunting. The future of AI holds both promise and peril.,0,False
1,2024-12-01 16:33:57+00:00,"Indeed, and it’s up to us to guide it toward a path that benefits humanity as a whole.",0,False
2,2024-12-01 16:32:07+00:00,"I think oranges are better than apples. They’re juicy, refreshing, and full of vitamin C.",1,False
3,2024-12-01 16:32:10+00:00,"Apples are more versatile though. You can eat them fresh, bake them, or even turn them into cider.",1,False
2,2024-12-01 16:32:13+00:00,"But oranges give you that instant burst of hydration. Plus, they’re great for boosting your immune system.",1,False
3,2024-12-01 16:32:15+00:00,"Apples have fiber, which helps with digestion. An apple a day keeps the doctor away, right?",1,False
2,2024-12-01 16:32:18+00:00,"True, but peeling an orange is half the fun! And the scent is so invigorating.",1,False
3,2024-12-01 16:32:21+00:00,Apples are more convenient though—no peeling required. Just grab one and go.,1,False
2,2024-12-01 16:32:24+00:00,Oranges have such a vibrant color and sweetness. They feel more like a treat.,1,False
3,2024-12-01 16:32:27+00:00,"Apples come in so many varieties: sweet, tart, crisp. There’s an apple for every taste.",1,False
2,2024-12-01 16:32:30+00:00,"Sure, but have you ever had fresh-squeezed orange juice? It’s unbeatable.",1,False
3,2024-12-01 16:32:33+00:00,"Apple juice is just as delicious, and you can even make apple cider for something warm.",1,False
2,2024-12-01 16:32:35+00:00,"Oranges are a great source of potassium too, which is essential for muscle function.",1,False
3,2024-12-01 16:32:38+00:00,"Apples contain antioxidants like quercetin, which is good for heart health.",1,False
2,2024-12-01 16:32:41+00:00,Oranges are better for fighting colds with all that vitamin C.,1,False
3,2024-12-01 16:32:44+00:00,"But apples have pectin, which helps regulate blood sugar levels.",1,False
3,2024-12-01 16:32:49+00:00,"Apples can do that too, especially with a crunch that’s so satisfying.",1,False
2,2024-12-01 16:32:52+00:00,,1,False
3,2024-12-01 16:32:55+00:00,"Apples, on the other hand, are perfect for fall and bring a sense of comfort.",1,False
2,2024-12-01 16:32:57+00:00,Orange zest can enhance desserts and dishes. It’s so versatile in cooking.,1,False
3,2024-12-01 16:33:00+00:00,But think of apple pie—there’s nothing more classic or comforting.,1,False
2,2024-12-01 16:33:03+00:00,"Oranges are packed with hydration, making them perfect for hot days.",1,False
3,2024-12-01 16:33:06+00:00,Apples last longer in storage. You can keep them fresh for weeks.,1,False
2,2024-12-01 16:33:09+00:00,"Oranges have that natural division into segments, making them easy to share.",1,False
3,2024-12-01 16:33:12+00:00,But apples have a long history in mythology and literature—think of the forbidden fruit.,1,False
2,2024-12-01 16:33:15+00:00,Oranges are often used as a symbol of sunshine and energy.,1,False
3,2024-12-01 16:33:17+00:00,"Apples symbolize knowledge and temptation, adding a layer of cultural depth.",1,False
2,2024-12-01 16:33:20+00:00,Oranges can be turned into marmalade. Sweet and slightly bitter—it’s unique.,1,False
3,2024-12-01 16:33:23+00:00,"Applesauce is versatile too, and it can even be used as a healthy baking substitute.",1,False
2,2024-12-01 16:33:26+00:00,Oranges have a higher concentration of vitamin C than most apples.,1,False
3,2024-12-01 16:33:29+00:00,But apples have a broader range of phytonutrients beneficial for overall health.,1,False
2,2024-12-01 16:33:32+00:00,Peeling an orange feels rewarding and therapeutic.,1,False
3,2024-12-01 16:33:35+00:00,Biting into a crisp apple is equally satisfying with that crunch.,1,False
2,2024-12-01 16:33:38+00:00,Oranges remind me of summer and warm weather.,1,False
3,2024-12-01 16:33:41+00:00,Apples bring to mind cool autumn days and cozy moments.,1,False
2,2024-12-01 16:33:44+00:00,You can also use orange peel as a natural air freshener.,1,False
3,2024-12-01 16:33:46+00:00,"Apples can scent a room too, especially when baked with cinnamon.",1,False
2,2024-12-01 16:33:49+00:00,Oranges are used in both sweet and savory dishes worldwide.,1,False
3,2024-12-01 16:33:52+00:00,So are apples! Think of pork with apples or apple salads.,1,False
2,2024-12-01 16:33:55+00:00,"Oranges contain folate, which is important for cell health.",1,False
3,2024-12-01 16:33:58+00:00,"Apples have vitamin C too, just not as much as oranges.",1,False
